{"$schema":"https://json-schema.org/draft/2020-12/schema","$id":"https://github.com/pirosiki1144/japan-tax-and-public-burden/schemas/monitoring-review.schema.json","type":"object","additionalProperties":false,"required":["schema_version","reviewed_at","baseline"],"properties":{"schema_version":{"const":1},"reviewed_at":{"type":"string","format":"date-time"},"baseline":{"type":"object"},"reviews":{"type":"array","items":{"type":"object"}}}}
