{
  "schema_version": 1,
  "reviewed_at": "2026-08-19T22:39:55Z",
  "baseline": {
    "schema_version": 1,
    "reviewed_at": "2026-08-19T22:39:55Z",
    "records": [
      {
        "schema_version": 1,
        "tax_id": "automobile-tax",
        "law_id": "325AC0000000226",
        "law_title": "地方税法",
        "revision_id": "325AC0000000226_20260731_508AC0000000002",
        "updated_at": "2026-06-16T16:03:55+09:00",
        "source_url": "https://laws.e-gov.go.jp/api/2/law_data/325AC0000000226",
        "taxpayer_rules": [
          {
            "role": "owner",
            "article_num": "146",
            "paragraph_num": "1",
            "raw": "自動車税は、自動車に対し、主たる定置場所在の道府県において、その所有者に課する。"
          },
          {
            "role": "user_when_owner_exempt",
            "article_num": "146",
            "paragraph_num": "2",
            "raw": "２自動車の所有者が第百四十八条第一項の規定により自動車税を課することができない者である場合には、前項の規定にかかわらず、当該自動車の使用者に自動車税を課する。ただし、公用又は公共の用に供する自動車については、この限りでない。"
          }
        ],
        "rates": [
          {
            "category_path": [
              "一　乗用車（三輪の小型自動車であるものを除く。）",
              "イ　営業用"
            ],
            "condition": "（１）　総排気量が一リットル以下のもの",
            "amount_yen": 7500,
            "amount_raw": "七千五百円",
            "period": "annual",
            "article_num": "154"
          },
          {
            "category_path": [
              "一　乗用車（三輪の小型自動車であるものを除く。）",
              "イ　営業用"
            ],
            "condition": "（２）　総排気量が一リットルを超え、一・五リットル以下のもの",
            "amount_yen": 8500,
            "amount_raw": "八千五百円",
            "period": "annual",
            "article_num": "154"
          },
          {
            "category_path": [
              "一　乗用車（三輪の小型自動車であるものを除く。）",
              "イ　営業用"
            ],
            "condition": "（３）　総排気量が一・五リットルを超え、二リットル以下のもの",
            "amount_yen": 9500,
            "amount_raw": "九千五百円",
            "period": "annual",
            "article_num": "154"
          },
          {
            "category_path": [
              "一　乗用車（三輪の小型自動車であるものを除く。）",
              "イ　営業用"
            ],
            "condition": "（４）　総排気量が二リットルを超え、二・五リットル以下のもの",
            "amount_yen": 13800,
            "amount_raw": "一万三千八百円",
            "period": "annual",
            "article_num": "154"
          },
          {
            "category_path": [
              "一　乗用車（三輪の小型自動車であるものを除く。）",
              "イ　営業用"
            ],
            "condition": "（５）　総排気量が二・五リットルを超え、三リットル以下のもの",
            "amount_yen": 15700,
            "amount_raw": "一万五千七百円",
            "period": "annual",
            "article_num": "154"
          },
          {
            "category_path": [
              "一　乗用車（三輪の小型自動車であるものを除く。）",
              "イ　営業用"
            ],
            "condition": "（６）　総排気量が三リットルを超え、三・五リットル以下のもの",
            "amount_yen": 17900,
            "amount_raw": "一万七千九百円",
            "period": "annual",
            "article_num": "154"
          },
          {
            "category_path": [
              "一　乗用車（三輪の小型自動車であるものを除く。）",
              "イ　営業用"
            ],
            "condition": "（７）　総排気量が三・五リットルを超え、四リットル以下のもの",
            "amount_yen": 20500,
            "amount_raw": "二万五百円",
            "period": "annual",
            "article_num": "154"
          },
          {
            "category_path": [
              "一　乗用車（三輪の小型自動車であるものを除く。）",
              "イ　営業用"
            ],
            "condition": "（８）　総排気量が四リットルを超え、四・五リットル以下のもの",
            "amount_yen": 23600,
            "amount_raw": "二万三千六百円",
            "period": "annual",
            "article_num": "154"
          },
          {
            "category_path": [
              "一　乗用車（三輪の小型自動車であるものを除く。）",
              "イ　営業用"
            ],
            "condition": "（９）　総排気量が四・五リットルを超え、六リットル以下のもの",
            "amount_yen": 27200,
            "amount_raw": "二万七千二百円",
            "period": "annual",
            "article_num": "154"
          },
          {
            "category_path": [
              "一　乗用車（三輪の小型自動車であるものを除く。）",
              "イ　営業用"
            ],
            "condition": "（１０）　総排気量が六リットルを超えるもの",
            "amount_yen": 40700,
            "amount_raw": "四万七百円",
            "period": "annual",
            "article_num": "154"
          },
          {
            "category_path": [
              "一　乗用車（三輪の小型自動車であるものを除く。）",
              "ロ　自家用"
            ],
            "condition": "（１）　総排気量が一リットル以下のもの",
            "amount_yen": 25000,
            "amount_raw": "二万五千円",
            "period": "annual",
            "article_num": "154"
          },
          {
            "category_path": [
              "一　乗用車（三輪の小型自動車であるものを除く。）",
              "ロ　自家用"
            ],
            "condition": "（２）　総排気量が一リットルを超え、一・五リットル以下のもの",
            "amount_yen": 30500,
            "amount_raw": "三万五百円",
            "period": "annual",
            "article_num": "154"
          },
          {
            "category_path": [
              "一　乗用車（三輪の小型自動車であるものを除く。）",
              "ロ　自家用"
            ],
            "condition": "（３）　総排気量が一・五リットルを超え、二リットル以下のもの",
            "amount_yen": 36000,
            "amount_raw": "三万六千円",
            "period": "annual",
            "article_num": "154"
          },
          {
            "category_path": [
              "一　乗用車（三輪の小型自動車であるものを除く。）",
              "ロ　自家用"
            ],
            "condition": "（４）　総排気量が二リットルを超え、二・五リットル以下のもの",
            "amount_yen": 43500,
            "amount_raw": "四万三千五百円",
            "period": "annual",
            "article_num": "154"
          },
          {
            "category_path": [
              "一　乗用車（三輪の小型自動車であるものを除く。）",
              "ロ　自家用"
            ],
            "condition": "（５）　総排気量が二・五リットルを超え、三リットル以下のもの",
            "amount_yen": 50000,
            "amount_raw": "五万円",
            "period": "annual",
            "article_num": "154"
          },
          {
            "category_path": [
              "一　乗用車（三輪の小型自動車であるものを除く。）",
              "ロ　自家用"
            ],
            "condition": "（６）　総排気量が三リットルを超え、三・五リットル以下のもの",
            "amount_yen": 57000,
            "amount_raw": "五万七千円",
            "period": "annual",
            "article_num": "154"
          },
          {
            "category_path": [
              "一　乗用車（三輪の小型自動車であるものを除く。）",
              "ロ　自家用"
            ],
            "condition": "（７）　総排気量が三・五リットルを超え、四リットル以下のもの",
            "amount_yen": 65500,
            "amount_raw": "六万五千五百円",
            "period": "annual",
            "article_num": "154"
          },
          {
            "category_path": [
              "一　乗用車（三輪の小型自動車であるものを除く。）",
              "ロ　自家用"
            ],
            "condition": "（８）　総排気量が四リットルを超え、四・五リットル以下のもの",
            "amount_yen": 75500,
            "amount_raw": "七万五千五百円",
            "period": "annual",
            "article_num": "154"
          },
          {
            "category_path": [
              "一　乗用車（三輪の小型自動車であるものを除く。）",
              "ロ　自家用"
            ],
            "condition": "（９）　総排気量が四・五リットルを超え、六リットル以下のもの",
            "amount_yen": 87000,
            "amount_raw": "八万七千円",
            "period": "annual",
            "article_num": "154"
          },
          {
            "category_path": [
              "一　乗用車（三輪の小型自動車であるものを除く。）",
              "ロ　自家用"
            ],
            "condition": "（１０）　総排気量が六リットルを超えるもの",
            "amount_yen": 110000,
            "amount_raw": "十一万円",
            "period": "annual",
            "article_num": "154"
          },
          {
            "category_path": [
              "二　トラック（三輪の小型自動車であるものを除く。）",
              "イ　営業用（けん引自動車であるもの及び被けん引自動車であるものを除く。）"
            ],
            "condition": "（１）　最大積載量が一トン以下のもの",
            "amount_yen": 6500,
            "amount_raw": "六千五百円",
            "period": "annual",
            "article_num": "154"
          },
          {
            "category_path": [
              "二　トラック（三輪の小型自動車であるものを除く。）",
              "イ　営業用（けん引自動車であるもの及び被けん引自動車であるものを除く。）"
            ],
            "condition": "（２）　最大積載量が一トンを超え、二トン以下のもの",
            "amount_yen": 9000,
            "amount_raw": "九千円",
            "period": "annual",
            "article_num": "154"
          },
          {
            "category_path": [
              "二　トラック（三輪の小型自動車であるものを除く。）",
              "イ　営業用（けん引自動車であるもの及び被けん引自動車であるものを除く。）"
            ],
            "condition": "（３）　最大積載量が二トンを超え、三トン以下のもの",
            "amount_yen": 12000,
            "amount_raw": "一万二千円",
            "period": "annual",
            "article_num": "154"
          },
          {
            "category_path": [
              "二　トラック（三輪の小型自動車であるものを除く。）",
              "イ　営業用（けん引自動車であるもの及び被けん引自動車であるものを除く。）"
            ],
            "condition": "（４）　最大積載量が三トンを超え、四トン以下のもの",
            "amount_yen": 15000,
            "amount_raw": "一万五千円",
            "period": "annual",
            "article_num": "154"
          },
          {
            "category_path": [
              "二　トラック（三輪の小型自動車であるものを除く。）",
              "イ　営業用（けん引自動車であるもの及び被けん引自動車であるものを除く。）"
            ],
            "condition": "（５）　最大積載量が四トンを超え、五トン以下のもの",
            "amount_yen": 18500,
            "amount_raw": "一万八千五百円",
            "period": "annual",
            "article_num": "154"
          },
          {
            "category_path": [
              "二　トラック（三輪の小型自動車であるものを除く。）",
              "イ　営業用（けん引自動車であるもの及び被けん引自動車であるものを除く。）"
            ],
            "condition": "（６）　最大積載量が五トンを超え、六トン以下のもの",
            "amount_yen": 22000,
            "amount_raw": "二万二千円",
            "period": "annual",
            "article_num": "154"
          },
          {
            "category_path": [
              "二　トラック（三輪の小型自動車であるものを除く。）",
              "イ　営業用（けん引自動車であるもの及び被けん引自動車であるものを除く。）"
            ],
            "condition": "（７）　最大積載量が六トンを超え、七トン以下のもの",
            "amount_yen": 25500,
            "amount_raw": "二万五千五百円",
            "period": "annual",
            "article_num": "154"